date,title,description,source,url,published_at
2026-07-04,"President Donald Trump and Fed Chair Kevin Warsh Are on a Collision Course Over Interest Rates, and Things May Get Ugly for Wall Street",A new Fed chair isn't a panacea for the ideological gap between the president and the central bank over interest rates.,finance.yahoo.com,https://finance.yahoo.com/economy/policy/articles/president-donald-trump-fed-chair-082600367.html,
2026-07-06,Fed Chairman Kevin Warsh Just Said 6 Words That Completely Shifted Investor Expectations,The future looks a lot different after Warsh made his policy goals clear for the Federal Reserve.,finance.yahoo.com,https://finance.yahoo.com/economy/policy/articles/fed-chairman-kevin-warsh-just-100100246.html,
2026-07-06,Fed's Waller says forward guidance 'more art than science',"Federal Reserve Gov. Christopher Waller says he is OK with dialing down the amount of communication issued by the central bank's monetary policy committee, but doesn't want the central bank to throw out the baby with the bathwater.",americanbanker.com,https://www.americanbanker.com/news/feds-waller-says-forward-guidance-more-art-than-science,
2026-07-04,Trump allies double down on efforts to reshape Federal Reserve,"Cook remains a target after the high court allowed her to stay in her job for now, as does former Chair Jerome Powell.",fortune.com,https://fortune.com/2026/07/04/trump-allies-federal-reserve-board-independence-lisa-cook-jerome-powell-atlanta-fed/,
2026-07-06,"Gold’s Rebound Signals Markets May Have Mispriced The Fed, Says deVere CEO","Gold's recovery this week may be more than a technical rebound. According to deVere Group CEO Nigel Green, it could be an early indication that investors are",financefeeds.com,https://financefeeds.com/golds-rebound-signals-markets-may-have-mispriced-the-fed-says-devere-ceo/,
2026-07-06,Gold eases from two-week high as firmer US dollar weighs,"Gold retreats from a two-week high as a stronger US dollar impacts prices, with JP Morgan forecasting $4,300/oz in Q3 2026.",thehindubusinessline.com,https://www.thehindubusinessline.com/markets/gold/gold-eases-from-two-week-high-as-firmer-us-dollar-weighs/article71188057.ece,
2026-07-06,"Key Events This Week: ISM, FOMC Minutes And Fed Speakers","ZeroHedge - On a long enough timeline, the survival rate for everyone drops to zero",zerohedge.com,https://www.zerohedge.com/markets/key-events-week-ism-fomc-minutes-and-fed-speakers,
2026-07-06,"Gold slips ₹150, silver drops ₹5,000 as strong US dollar dents bullion demand",Gold and silver prices drop as a strong US dollar impacts demand amid geopolitical tensions and Fed policy expectations.,thehindubusinessline.com,https://www.thehindubusinessline.com/markets/gold/gold-slips-150-silver-drops-5000-as-strong-us-dollar-dents-bullion-demand/article71188756.ece,
2026-07-05,Kevin Warsh Must Explain That The Fed Simply Cannot Fight Inflation,The Fed couldn’t fight what economists incorrectly deem inflation even if it wanted to.,flipboard.com,https://www.forbes.com/sites/johntamny/2026/07/05/kevin-warsh-owes-fed-watchers-truth-about-their-inflation-confusion/,
2026-07-03,"European Markets Close Higher Note On Easing Geopolitical, Interest Rate Concerns","After struggling for direction till around noon, European stocks moved higher and closed on a firm note on Friday on easing concerns about Middle East tensions and hopes that the Federal Reserve will not tighten its monetary policy for now.",rttnews.com,https://www.rttnews.com/story.aspx?Id=3664584,
2026-07-06,Gold steadies after weekly gain as rate-hike worries recede,"Gold prices stabilize near $4,190 after a weekly gain, as rate-hike concerns diminish amid soft US jobs data.",thehindubusinessline.com,https://www.thehindubusinessline.com/markets/gold/gold-steadies-after-weekly-gain-as-rate-hike-worries-recede/article71187812.ece,
2026-07-06,Trump’s war means higher global interest rates for years to come,"Global interest rates are set to remain higher for longer, with Bloomberg Economics forecasting borrowing costs elevated by up to half a percentage point through 2028. This shift, influenced by lingering inflation risks from the Iran conflict's energy shock and the AI race, means consumers and businesses face more expensive loans. Central banks, wary of past inflation surges, are maintaining hawkish stances, impacting economies worldwide.",economictimes.indiatimes.com,https://economictimes.indiatimes.com/news/economy/indicators/trumps-war-means-higher-global-interest-rates-for-years-to-come/articleshow/132206129.cms,
2026-07-06,"Gold, Silver Rate Today Live Updates: Yellow metal holds near two-week high after weak US jobs data; silver extends gains","Gold prices began the week on a firm footing, holding close to a two-week high after weaker-than-expected US employment data reinforced expectations",timesofindia.indiatimes.com,https://timesofindia.indiatimes.com/business/india-business/gold-silver-rate-today-live-updates-18k-22-carat-24k-gold-price-10g-silver-cost-per-kg-mcx-comex-etf-stock-precious-metal-gold-prediction-city-wise-cost-latest-gold-news/liveblog/132205915.cms,
2026-07-05,"Dalal Street to track oil, earnings, global trends","India Business News: NEW DELHI: Trading sentiment in the stock market this week will depend on crude oil prices, global trends and the start of corporate earnings season w.",timesofindia.indiatimes.com,https://timesofindia.indiatimes.com/business/india-business/dalal-street-to-track-oil-earnings-global-trends/articleshow/132204811.cms,
2026-07-03,Why the Supreme Court's Ruling on the Fed This Week Is Good for the Stock Market,Central bank independence is critical to economic growth and healthy financial markets.,finance.yahoo.com,https://finance.yahoo.com/economy/policy/articles/why-supreme-courts-ruling-fed-165000621.html,
2026-07-08,Fed policymakers' inflation worries weighed on rate cut outlook at Warsh's first meeting,"Federal Reserve FOMC minutes reveal growing inflation concerns and scenarios for rate cuts or rate hikes depending on tariffs, AI demand and Middle East conflict.",foxbusiness.com,https://www.foxbusiness.com/economy/fed-policymakers-inflation-worries-weighed-rate-cut-outlook-warshs-first-meeting,
2026-07-07,Gold prices weaken as investors await Federal Reserve meeting minutes,"Gold prices moved lower on Tuesday as traders adopted a cautious stance ahead of the publication of the Federal Reserve’s latest policy meeting minutes, which are expected to provide fresh clues on the outlook for US interest rates. By 05:30 ET (09:30 GMT), spot gold had fallen 1.",finance.yahoo.com,https://finance.yahoo.com/markets/commodities/articles/gold-prices-weaken-investors-await-102323496.html,
2026-07-08,Fed minutes due as analysts debate whether Warsh will curtail them,"July 8 (Reuters) - A critical readout on Wednesday of the first Federal Reserve policy meeting overseen by Chairman Kevin Warsh may offer greater insight into the ""family fight"" the new central bank",finance.yahoo.com,https://finance.yahoo.com/economy/policy/articles/fed-minutes-due-analysts-debate-100404481.html,
2026-07-06,Gold Slips as Stronger U.S. Dollar Weighs on Bullion,Dollar Recovery Pressures Gold PricesSpot gold traded lower on Monday as the U. S.,finance.yahoo.com,https://finance.yahoo.com/markets/commodities/articles/gold-slips-stronger-u-dollar-130032421.html,
2026-07-07,Impacts of a New Fed Regime,"Last week, U.S. Federal Reserve (Fed) Chair Kevin Warsh held his first press conference following the Federal Open Market Committee (FOMC) meeting.",etftrends.com,https://www.etftrends.com/etf-strategist-content-hub/impacts-of-a-new-fed-regime/,
2026-07-06,7 Key Factors Influencing Commercial Real Estate Loan Rates Today,"Discover the 7 key factors influencing commercial real estate loan rates today. Understand how market trends, economic conditions, and lender policies impact your financing options in the commercial real estate sector.",smallbiztrends.com,https://smallbiztrends.com/commercial-real-estate-loan-rates-today/,
2026-07-08,"Fed officials were split on direction of interest rates at last meeting, minutes show",The Federal Reserve on Wednesday released minutes from its June 16-17 meeting.,cnbc.com,https://www.cnbc.com/2026/07/08/fed-minutes-june-2026-.html,
2026-07-08,FOMC Minutes Preview: Scrutiny For Hawkish Bias,"ZeroHedge - On a long enough timeline, the survival rate for everyone drops to zero",zerohedge.com,https://www.zerohedge.com/markets/fomc-minutes-preview-scrutiny-hawkish-bias,
2026-07-09,Global markets on edge as oil rally revives inflation and rate concerns.,"Oil prices surged, reigniting concerns about inflation and market volatility. Investors reassessed interest rate expectations after US President Donald Trump's comments. Geopolitical developments added to equity market uncertainty, which was already questioning AI-driven rallies.",economictimes.indiatimes.com,https://economictimes.indiatimes.com/markets/us-stocks/news/global-markets-on-edge-as-oil-rally-revives-inflation-and-rate-concerns-/articleshow/132278203.cms,
2026-07-09,"The Precious Metals Rally Stalled, But Does A Bull Case Remain?",The precious metals rally peaked in January 2026 amid central bank independence concerns and growing rate hike expectations.,seekingalpha.com,https://seekingalpha.com/article/4920762-precious-metals-rally-stalled-does-bull-case-remain,
2026-07-08,Thai monetary policy supports economic recovery: central bank,"Thailand's accommodative monetary policy  stance and targeted financial ‌measures are supporting an economic recovery, the minutes of the Bank of Thailand's (BoT) meeting on June 24 showed on Wednesday.",bangkokpost.com,https://www.bangkokpost.com/business/general/3282885/thai-monetary-policy-settings-are-supporting-economic-recovery-central-bank-minutes-show,
2026-07-07,Consumer “Inflation Expectations” Throw the Fed another Curveball,"The Fed watches inflation expectations closely. It wants them to remain “anchored.” But consumer inflation expectations have become unanchored.

Metrics of ...",wolfstreet.com,https://wolfstreet.com/2026/07/07/consumer-inflation-expectations-throw-the-fed-another-curveball/,
2026-07-09,Gold falls as West Asia hostilities revive inflation woes,"Gold prices drop as renewed West Asia tensions increase inflation fears, while Bank of America revises 2026 forecast lower.",thehindubusinessline.com,https://www.thehindubusinessline.com/markets/gold/gold-falls-as-west-asia-hostilities-revive-inflation-woes/article71200918.ece,
2026-07-10,"US-Iran Conflict, Federal Reserve Policy Outlook, and Global Central Bank Divergence, July 10, 2026","Geopolitical tensions, persistent US interest rate hike expectations, and divergent global central bank policies are currently driving international financial market volatility.",financefeeds.com,https://financefeeds.com/us-iran-conflict-federal-reserve-policy-outlook-and-global-central-bank-divergence-july-10-2026/,2026-07-10T13:46:38.000000Z
2026-07-11,Fed Governor Christopher Waller Just Drove a Dagger Through President Donald Trump's Demand for Lower Interest Rates,"Members of the Federal Open Market Committee (FOMC), including Fed Board Governor Waller, have begun indirectly jabbing back at the president's frequent calls for lower rates.",finance.yahoo.com,https://finance.yahoo.com/economy/policy/articles/fed-governor-christopher-waller-just-122600176.html,2026-07-11T12:26:00.000000Z
2026-07-11,"Fed officials fret over inflation risk, weigh rate hikes",Federal Reserve officials remain concerned about persistent inflation pressures.  Incoming price reports will guide future interest rate decisions by policymakers.  A divided committee discussed scenarios for potential policy responses.  Some officials favor holding rates steady while others see hikes as appropriate.  The central bank awaits crucial economic data to shape its next move.,economictimes.indiatimes.com,https://economictimes.indiatimes.com/markets/us-stocks/news/fed-officials-fret-over-inflation-risk-weigh-rate-hikes/articleshow/132324219.cms,2026-07-11T03:38:32.000000Z
2026-07-10,"Uh-Oh! The Fed Just Singled Out a New Inflationary Pressure, and It's Awful News for Wall Street.",The stock market's biggest catalyst may bring about its own demise.,finance.yahoo.com,https://finance.yahoo.com/economy/policy/articles/uh-oh-fed-just-singled-112600991.html,2026-07-10T11:26:00.000000Z
2026-07-10,"US Stock Market: Fed's Williams sees energy prices easing despite Middle East tensions, keeps options open on July rate decision","New York Fed President John Williams said oil prices are likely to ease over the coming months despite renewed Middle East tensions, while stressing it is too early to signal the Federal Reserve's next interest rate move. He reiterated that policymakers will remain guided by incoming economic data amid persistent inflation uncertainty.",economictimes.indiatimes.com,https://economictimes.indiatimes.com/markets/us-stocks/news/us-stock-market-feds-williams-sees-energy-prices-easing-despite-middle-east-tensions-keeps-options-open-on-july-rate-decision/articleshow/132304392.cms,2026-07-10T06:10:14.000000Z
2026-07-10,Federal Reserve launches policy review panels with Marc Andreessen and Raghuram Rajan,The Federal Reserve appoints Marc Andreessen to co-lead an AI-focused monetary policy task force as Kevin Warsh launches a sweeping review of Fed frameworks.,thehindubusinessline.com,https://www.thehindubusinessline.com/money-and-banking/marc-andreessen-raghuram-rajan-join-federal-reserves-monetary-policy-review-initiative/article71206903.ece,2026-07-10T14:14:23.000000Z
2026-07-10,Gold heads for weekly drop as Gulf attacks reinforce rate-hike bets,Gold prices rise slightly but face a weekly drop amid Gulf tensions and heightened rate-hike expectations from the Fed.,thehindubusinessline.com,https://www.thehindubusinessline.com/markets/gold/gold-heads-for-weekly-drop-as-gulf-attacks-reinforce-rate-hike-bets/article71205168.ece,2026-07-10T04:00:19.000000Z
2026-07-10,"US Fed appoints Marc Andreessen to co-lead productivity, jobs task force to assess economic impact of new technologies",The US Federal Reserve has formed five task forces to modernize its monetary policy framework. Marc Andreessen will co-lead a task force examining technology's economic impact. These groups will provide independent recommendations to the Federal Open Market Committee. Prominent global economists and policymakers are participating in these important panels.,economictimes.indiatimes.com,https://economictimes.indiatimes.com/news/international/world-news/us-fed-appoints-marc-andreessen-to-co-lead-productivity-jobs-task-force-to-assess-economic-impact-of-new-technologies/articleshow/132302175.cms,2026-07-10T03:35:36.000000Z
2026-07-11,"Raghuram Rajan, Microsoft's Asha Sharma among Indian-origin appointees to US Fed review panels",US Federal Reserve appointed Indian-origin experts for policy review. Raghuram Rajan and Raj Chetty will join task forces. Asha Sharma will assess technology's impact on jobs and growth. These panels will examine monetary policy tools and data. The review aims to adapt the Fed to economic changes.,economictimes.indiatimes.com,https://economictimes.indiatimes.com/news/international/world-news/raghuram-rajan-microsofts-asha-sharma-among-indian-origin-appointees-to-us-fed-review-panels/articleshow/132324231.cms,2026-07-11T03:43:48.000000Z
2026-07-10,"Kevin Warsh Has Grand Ambitions for the Fed, But a ""Family Fight"" Stands in His Way",Warsh seeks to implement a regime change at the Fed.,finance.yahoo.com,https://finance.yahoo.com/economy/policy/articles/kevin-warsh-grand-ambitions-fed-105000885.html,2026-07-10T10:50:00.000000Z
2026-07-10,XRP Chart is Painful to Watch: Another 40% Decline Likely,"XRP price risks a 40% drop toward $0.68 as US-Iran war risks, hawkish Fed bets, and a bear pennant breakdown pressure the token.",finance.yahoo.com,https://finance.yahoo.com/markets/crypto/articles/xrp-chart-painful-watch-another-081915648.html,2026-07-10T08:19:15.000000Z
2026-07-10,Fed's message to Congress: We will bring down inflation,The Federal Reserve told lawmakers it,finance.yahoo.com,https://finance.yahoo.com/economy/policy/article/feds-message-to-congress-we-will-bring-down-inflation-160111719.html,2026-07-10T16:01:11.000000Z
2026-07-13,8 Best Stocks to Buy Following Federal Reserve Pivot Expectations,"The path of interest rates remains one of the single biggest swing factors for equity markets, and positioning ahead of the Federal Reserve's next move has become a defining trade for 2026.",insidermonkey.com,https://www.insidermonkey.com/blog/8-best-stocks-to-buy-following-federal-reserve-pivot-expectations-1798591/,2026-07-13T00:53:36.000000Z
2026-07-11,AI Making Life More Expensive for You? Federal Reserve Says 'Upward Pressure' Likely to Sustain for Now,The Federal Reserve said that artificial intelligence was a contributing factor to inflation in its June meeting minutes and cited “AI-related price pressures” as a driver of core goods inflation. Fed Points to AI-Related Price Pressures Minutes from the June...,finance.yahoo.com,https://finance.yahoo.com/economy/policy/articles/ai-making-life-more-expensive-023105001.html,2026-07-11T02:31:05.000000Z
2026-07-10,Warsh believes America's $700B AI buildout will lower prices — but his colleagues warn it will fuel persistent inflation,"While most Fed officials see AI spending as an inflation risk, Warsh is betting on productivity gains.",finance.yahoo.com,https://finance.yahoo.com/economy/policy/articles/warsh-believes-americas-700b-ai-151500764.html,2026-07-10T15:15:00.000000Z
2026-07-10,Who is on Fed Chair Kevin Warsh’s monetary policy review task forces?,"Meet the 15 economists, former central bankers and tech leaders, including Raghuram Rajan and Marc Andreessen, chosen for Kevin Warsh's Fed review panels.",thehindubusinessline.com,https://www.thehindubusinessline.com/money-and-banking/who-is-on-fed-chair-kevin-warshs-monetary-policy-review-task-forces/article71206950.ece,2026-07-10T14:12:36.000000Z
2026-07-10,Money supply features in first Fed monetary policy report under Warsh,The Federal Reserve issued its semiannual monetary policy report just days ahead of Fed Chair Kevin Warsh's inaugural testimony to Congress in his new role. The report highlights rising inflation and capital investment-driven economic growth.,americanbanker.com,https://www.americanbanker.com/news/money-supply-features-in-first-fed-monetary-policy-report-under-warsh,2026-07-10T16:43:05.000000Z
2026-07-10,"Fed report cites 'stepped-up' inflation due to tariffs, Iran war, AI buildout","WASHINGTON - U.S. inflation ""stepped up further this spring"" as the evolving impact of tariffs, a war-related rise in energy costs, and the booming artificial intelligence buildout boosted price pressures that took root last year, the Federal Reserve said on Friday in a monetary policy report to Congress.",flipboard.com,https://www.miamiherald.com/news/nation-world/national/article316460431.html,2026-07-10T16:14:02.000000Z
2026-07-12,Worst of inflation may be over for PH,"SURGING inflation appears to have run its course, Nomura Global Research said, but underlying pressures are expected to keep the Bangko Sentral ng Pilipinas (BSP) on track for further interest rate hikes this year.",manilatimes.net,https://www.manilatimes.net/2026/07/13/business/worst-of-inflation-may-be-over-for-ph/2382975,2026-07-12T16:04:00.000000Z
2026-07-10,"Gold prices fall to Rs 1.44 lakh/10 gram; silver dips Rs 6,300 this week as Iran war raises inflation worries. What’s next?","Gold prices slipped while silver edged higher on the MCX on Friday, supported by a weaker U.S. dollar. However, both precious metals remained on track for weekly losses as escalating U.S.-Iran tensions fuelled inflation concerns and strengthened expectations of tighter U.S. Federal Reserve policy.",economictimes.indiatimes.com,https://economictimes.indiatimes.com/markets/commodities/news/gold-prices-fall-to-rs-1-44-lakh/10-gram-silver-dips-rs-6300-this-week-as-iran-war-raises-inflation-worries-whats-next/articleshow/132302618.cms,2026-07-10T04:03:43.000000Z
2026-07-10,US Stock Market: Treasury yields ease as investors buy bonds after selloff; strong auction boosts sentiment,"US Treasury prices saw gains as investors bought bonds following a sharp selloff. A strong auction of 30-year government bonds attracted significant foreign investor demand. Economic data indicated stable labor and moderating housing markets, reinforcing Fed rate hold expectations. Geopolitical tensions involving the United States and Iran remained a key focus for markets. Investors anticipate stable Federal Reserve interest rates and potential future cuts.",economictimes.indiatimes.com,https://economictimes.indiatimes.com/markets/us-stocks/news/us-stock-market-treasury-yields-ease-as-investors-buy-bonds-after-selloff-strong-auction-boosts-sentiment/articleshow/132303499.cms,2026-07-10T05:17:44.000000Z
2026-07-11,The June jobs report laid an egg: The US only added roughly half of what economists had forecast — what it means for you,"Payrolls badly missed the 115,000 economists expected, and the unemployment rate's dip to 4.2% masked a shrinking labor force. Now it's Fed Chair Kevin Warsh's problem.",finance.yahoo.com,https://finance.yahoo.com/economy/articles/june-jobs-report-laid-egg-101500027.html,2026-07-11T10:15:00.000000Z
2026-07-11,"Wall Street Week Ahead: Investors to grapple with packed week of earnings, CPI, Iran headlines","Upcoming economic data and corporate earnings will test the resilient U.S. stock market. Major banks begin second-quarter earnings season, which is expected to be strong. Key economic reports, including the consumer price index, are due next week. Oil prices jumped amid concerns over renewed attacks on shipping and global supplies. Investors seek rate-path signs from inflation data and geopolitical developments.",economictimes.indiatimes.com,https://economictimes.indiatimes.com/markets/us-stocks/news/wall-st-week-ahead-investors-to-grapple-with-packed-week-of-earnings-cpi-iran-headlines/articleshow/132324249.cms,2026-07-11T03:41:45.000000Z
2026-07-10,"Global Market: Japan wholesale inflation hits over three-year high, reinforcing BOJ rate hike expectations",Japan's wholesale inflation accelerated to its fastest pace in more than three years in June as companies passed on higher input costs driven by the Middle East conflict and a weaker yen. The stronger-than-expected reading has reinforced expectations that the Bank of Japan could raise interest rates again later this year.,economictimes.indiatimes.com,https://economictimes.indiatimes.com/markets/us-stocks/news/global-market-japan-wholesale-inflation-hits-over-three-year-high-reinforcing-boj-rate-hike-expectations/articleshow/132303427.cms,2026-07-10T05:08:09.000000Z
2026-07-10,"Japan's wholesale inflation spikes as fuel costs, weak yen bite","Japan's wholesale inflation surged at its fastest pace in over three years. This acceleration was driven by rising fuel and metal prices, and a weak yen. The Bank of Japan warned of potential higher consumer inflation later this year. Government officials assured markets that monetary policy decisions remain with the central bank. These factors will influence the Bank of Japan's upcoming policy meeting.",economictimes.indiatimes.com,https://economictimes.indiatimes.com/news/economy/japans-wholesale-inflation-hits-3-year-high-fuel-costs-and-weak-yen-drive-prices-up/articleshow/132309086.cms,2026-07-10T10:17:26.000000Z
2026-07-10,US Dollar Price Forecast: Dollar Firms Amid Sticky Inflation – GBP/USD and EUR/USD Next Move?,The US Dollar remained firm amid sticky core inflation and monetary policy divergence. DXY held at $100.79 inside a blue ascending channel while EUR/USD held $1.1440 support and GBP/USD defended $1.3422 resistance zone. Technical setups and trade ideas inside.,finance.yahoo.com,https://finance.yahoo.com/markets/currencies/articles/us-dollar-price-forecast-dollar-081728366.html,2026-07-10T08:17:28.000000Z
2026-07-10,Global Market: Geopolitical risks return to centre stage for ECB as inflation fears resurface,"Fresh US-Iran hostilities have pushed the European Central Bank back to its inflation fight. Rising energy prices now threaten to reignite price pressures across the euro zone. This renewed conflict has heightened uncertainty around the inflation outlook for policymakers. Market expectations have shifted, with traders betting on further ECB rate hikes. Developments in the Middle East are now a key factor for future monetary policy.",economictimes.indiatimes.com,https://economictimes.indiatimes.com/markets/us-stocks/news/global-market-geopolitical-risks-return-to-centre-stage-for-ecb-as-inflation-fears-resurface/articleshow/132306863.cms,2026-07-10T08:16:36.000000Z
2026-07-12,Warsh Names Tech Visionary Marc Andreessen To Lead New AI Task Force,"Fed taps Marc Andreessen to assess AI's impact on productivity, signaling AI could shape future interest-rate policy and market valuations.",flipboard.com,https://www.forbes.com/sites/jonmarkman/2026/07/12/warsh-names-tech-visionary-marc-andreessen-to-lead-new-ai-task-force/,2026-07-12T05:53:48.000000Z
2026-07-11,"US Government Sold $743 Billion of Treasury Securities this Week, 30-Year Yield at 5.06% on Inflation, Lax Fed, Supply Fears","Lots of new supply: Treasury debt of notes and bonds outstanding ballooned by $70 billion this week.

The US government sold $743 billion of Treasury securities...",wolfstreet.com,https://wolfstreet.com/2026/07/10/us-government-sold-743-billion-of-treasury-securities-this-week-30-year-treasury-yield-at-5-06-on-fears-of-inflation-lax-fed-new-supply/,2026-07-11T01:58:29.000000Z
