date,title,description,source,url,published_at
2026-07-13,"US Stock Market: Inflation gathers pace as tariffs, energy costs and AI investment lift price pressures, says Fed","U.S. inflation accelerated during spring due to tariffs and rising energy costs. The Federal Reserve's report shows inflation remains significantly above its target. The labor market has largely stabilized, with demand and supply broadly in balance. Economic growth was moderate, supported by artificial intelligence infrastructure investment. Policymakers remain divided on the outlook for future interest rate adjustments.",economictimes.indiatimes.com,https://economictimes.indiatimes.com/markets/us-stocks/news/us-stock-market-inflation-gathers-pace-as-tariffs-energy-costs-and-ai-investment-lift-price-pressures-says-fed/articleshow/132356158.cms,2026-07-13T04:34:26.000000Z
2026-07-13,The Latest Inflation Data Will Drop on July 14. Here's Why It's a Big Deal for the Stock Market,The June reading of the Consumer Price Index will be released at 8:30 a.m. ET on July 14.,finance.yahoo.com,https://finance.yahoo.com/economy/policy/articles/latest-inflation-data-drop-july-143801630.html,2026-07-13T14:38:01.000000Z
2026-07-13,A July rate hike from the Fed? The odds are rising,Chances of a rate hike in July by the Federal Reserve rose as oil prices jumped on the latest developments in the Strait of Hormuz.,cnbc.com,https://www.cnbc.com/2026/07/13/-a-july-rate-hike-from-the-fed-the-odds-are-rising.html,2026-07-13T17:07:51.000000Z
2026-07-13,Waller says Fed shouldn't 'fight the last war' on inflation but warns hikes still possible,The Fed governor said inflation has expanded beyond the often-cited drivers such as the energy price spike in tariffs.,cnbc.com,https://www.cnbc.com/2026/07/13/waller-says-fed-shouldnt-fight-the-last-war-on-inflation-but-warns-hikes-still-possible.html,2026-07-13T16:33:49.000000Z
2026-07-12,Fed Chair Kevin Warsh Sends a Blunt Warning to Wall Street. What Should Investors Do?,New Fed chairman Kevin Warsh has made it clear that he is not here to rescue stocks.,finance.yahoo.com,https://finance.yahoo.com/economy/policy/articles/fed-chair-kevin-warsh-sends-110500965.html,2026-07-12T11:05:00.000000Z
2026-07-13,"Geopolitical Instability, US Debt Repression, and Central Bank Policy Outlook, July 13, 2026","Geopolitical instability, rising US debt-driven financial repression, and persistent inflationary pressures are currently dominating and destabilizing global financial market sentiment.",financefeeds.com,https://financefeeds.com/geopolitical-instability-us-debt-repression-and-central-bank-policy-outlook-july-13-2026/,2026-07-13T10:35:12.000000Z
2026-07-13,US-Iran War: Oil price rises signal another headache for Warsh and the Fed,"Escalating tensions between the U.S. and Iran have knock-on effects for inflation expectations and as a result, the trajectory of the base rate, notes Goldman Sachs.",fortune.com,https://fortune.com/2026/07/13/oil-price-rises-inflation-expectations-warsh-fed-goldman/,2026-07-13T10:44:35.000000Z
2026-07-13,Gold slides over 1% as oil surges on Strait of Hormuz closure fears,"Gold prices declined over one percent in early Asian trade Monday. Oil prices jumped sharply, increasing inflation concerns and interest rate expectations. U.S. and Iranian forces exchanged missile and drone assaults in the Gulf region. Federal Reserve chair testimony and economic data will offer policy clues. Gold speculators reduced net long positions while China increased its reserves.",economictimes.indiatimes.com,https://economictimes.indiatimes.com/markets/commodities/news/gold-slides-over-1-as-oil-surges-on-strait-of-hormuz-closure-fears/articleshow/132354518.cms,2026-07-13T01:52:37.000000Z
2026-07-13,Bitcoin weakens as oil-price spike revives inflation concerns,Bitcoin drops as rising oil prices amid US-Iran tensions revive inflation fears and interest rate concerns.,thehindubusinessline.com,https://www.thehindubusinessline.com/money-and-banking/cryptocurrency/bitcoin-weakens-as-oil-price-spike-revives-inflation-concerns/article71216021.ece,2026-07-13T05:13:00.000000Z
2026-07-13,"Oil Nears $75, Gold in Focus: Week Ahead CPI & PPI Test","USOIL climbs toward $75 on Iran-Hormuz tension while gold holds; traders eye US CPI near 3.9%, PPI, and UK GDP as the week's key market drivers.",financefeeds.com,https://financefeeds.com/weekly-data-oil-and-gold-price-review-for-the-week-ahead-71/,2026-07-13T15:58:48.000000Z
2026-07-13,European M&A proves more resilient than global peers despite ECB rate hike,"Martin Priestley/Getty Images European dealmaking was more durable than its global counterparts in the second quarter of this year, holding up amid a wave of geopolitical uncertainty that hit other major markets much harder. European M&A value fell 6.4% QoQ in Q2 to $344 billion, a shallower decline than the 24.3% drop recorded in North America, according to PitchBook’s Q2 2026 Global M&A Report. Deal count moved in the opposite direction, up 0.9% in Europe to 5,061, even as it fell an estimated",finance.yahoo.com,https://finance.yahoo.com/markets/stocks/articles/european-m-proves-more-resilient-111454745.html,2026-07-13T11:14:54.000000Z
2026-07-13,"Gold prices fall by Rs 2,000/10 grams, silver dips by Rs 5,400/kg as rising oil prices spur rate hike bets. Should you sell?","Gold and silver prices extended losses on the MCX for a second straight session on Monday amid rising oil prices triggered by fears of a Strait of Hormuz closure. Higher crude prices raised concerns over persistent inflation and prolonged high interest rates, weighing on precious metals.",economictimes.indiatimes.com,https://economictimes.indiatimes.com/markets/commodities/news/gold-prices-fall-by-rs-2000/10-grams-silver-dips-by-rs-5400/kg-as-rising-oil-prices-spur-rate-hike-bets-should-you-sell/articleshow/132356050.cms,2026-07-13T04:03:12.000000Z
2026-07-12,"Fed Chair Kevin Warsh Bets on AI, Taps Marc Andreessen and Xbox CEO Asha Sharma to Help 'Inform' Future Fed Policy",Federal Reserve chair Kevin Warsh has assembled a high-profile group of AI advocates to help evaluate how artificial intelligence could reshape the U.S. economy and influence future monetary policy. Fed’s New AI Task Force To Assess AI’s Economic Impact The...,finance.yahoo.com,https://finance.yahoo.com/economy/policy/articles/fed-chair-kevin-warsh-bets-133111165.html,2026-07-12T13:31:11.000000Z
2026-07-13,"Key Events This Week: CPI, PPI, Retail Sales, Warsh Testifies, China Data, And Earnings Galore","ZeroHedge - On a long enough timeline, the survival rate for everyone drops to zero",zerohedge.com,https://www.zerohedge.com/markets/key-events-week-cpi-ppi-retail-sales-warsh-testifies-china-data-and-earnings-galore,2026-07-13T13:47:03.000000Z
2026-07-13,"Retail Inflation Rises to 4.38% in June, Exceeds RBI's 4% Median Target","India's retail inflation rose to 4.38 per cent in June, driven primarily by costlier food items, pushing it above the Reserve Bank of India's median target of 4 per cent for the first time under the new series.",rediff.com,https://www.rediff.com/business/report/india-retail-inflation-jumps-to-438-in-june-above-rbi-target-experts-weigh-in/20260713.htm,2026-07-13T13:58:18.000000Z
2026-07-13,"Geopolitical tensions, inflation data to dictate gold and silver prices","Gold and silver are expected to remain volatile with a corrective bias as investors assess the latest flare-up in the US-Iran conflict, movements in crude oil prices, and inflation data, which could reshape expectations for global interest rates, according to analysts.",rediff.com,https://www.rediff.com/business/report/gold-silver-prices-under-pressure-us-iran-tensions-inflation-data-key-factors/20260713.htm,2026-07-13T03:35:00.000000Z
2026-07-13,"Gold drops below $4,000 as U.S.-Iran strikes lift crude oil, sparking rate-hike worries","Front-month gold futures plunged below $4,000/oz after fresh strikes between the US and Iran sent oil prices surging higher, reviving concerns about inflation and tighter monetary policy.",seekingalpha.com,https://seekingalpha.com/news/4613386-gold-drops-below-4000-as-us-iran-strikes-lift-crude-oil-sparking-rate-hike-worries,2026-07-13T21:37:16.000000Z
2026-07-13,Gold drops more than 1% as rising Middle East tensions add to rate-hike fears,"Gold prices saw a notable decline amidst rising tensions in the Middle East, driven by concerns over inflation linked to escalating oil prices. The prospect of an interest rate hike from the Federal Reserve in September is keeping traders on edge as they await crucial economic data releases this week. Prices for other precious metals also suffered losses on Monday.",economictimes.indiatimes.com,https://economictimes.indiatimes.com/markets/commodities/news/gold-drops-more-than-1-as-rising-middle-east-tensions-add-to-rate-hike-fears/articleshow/132368603.cms,2026-07-13T13:57:10.000000Z
2026-07-13,"India's inflation accelerates to 4.38% in June, exceeding forecasts","Inflation has risen for the eighth straight month in India, as food and energy prices rise due to the Iran war and deficient rainfall.",cnbc.com,https://www.cnbc.com/2026/07/13/india-june-inflation-oil-food-iran-war.html,2026-07-13T10:38:04.000000Z
2026-07-13,Cathie Wood Says AI Productivity Boom Could Push Long-Term Interest Rates Lower,"ARK's Cathie Wood said AI-driven productivity could lower long-term interest rates, citing the Industrial Revolution.",flipboard.com,https://www.benzinga.com/markets/economic-data/26/07/60407982/cathie-wood-says-ai-productivity-boom-could-push-long-term-interest-rates-lower,2026-07-13T09:49:47.000000Z
2026-07-13,Massive AI buildout poses latest U.S. inflation threat,Economists expect inflationary impact to last at least through this year,investmentexecutive.com,https://www.investmentexecutive.com/news/economy/massive-ai-buildout-poses-latest-u-s-inflation-threat/,2026-07-13T13:00:00.000000Z
2026-07-13,GUG: Worried About Inflation? Try Active Short Duration Bonds,"With the threat of inflation not going away any time soon, now may be time to pivot towards ultra-short bond ETFs with active management.",etftrends.com,https://www.etftrends.com/fixed-income-content-hub/worried-inflation-try-active-short-duration-bonds/,2026-07-13T12:00:41.000000Z
2026-07-13,"Dollar Index Edges Up Amidst Rate Cues, War Cries",The U.S. Dollar recorded a mixed performance against major currencies during the week ended July 10 as uncertainty about the Federal Reserve's monetary policy trajectory as well as safe haven demand triggered by the reignited Middle East conflict swayed market sentiment.,rttnews.com,https://www.rttnews.com/story.aspx?Id=3666419,2026-07-13T14:24:21.000000Z
2026-07-13,Treasury yields muted as U.S.-Iran ceasefire strained; investors await core inflation data,The yield on the 10-year U.S. Treasury note — the key benchmark for U.S. government borrowing — was broadly unchanged at 4.473%.,cnbc.com,https://www.cnbc.com/2026/07/13/treasury-yields-faltering-us-iran-ceasefire-bond-markets.html,2026-07-13T08:54:45.000000Z
2026-07-13,U.S. 2-year Treasury yield climbs near five-month high as rate-cut expectations fade (TLT:NASDAQ),U.S. 2-year Treasury yield hits 4.235% as Fed rate-cut bets fade.,seekingalpha.com,https://seekingalpha.com/news/4613201-us-2-year-treasury-yield-climbs-near-five-month-high-as-rate-cut-expectations-fade,2026-07-13T12:48:17.000000Z
