date,title,description,source,url,published_at
2026-07-12,Charting the global economy: Iran war continues to cloud outlook,"Japan's bank lending expansion suggests room for the central bank to raise rates further.  Meanwhile, high borrowing costs continue to impact the US housing market significantly.",economictimes.indiatimes.com,https://economictimes.indiatimes.com/small-biz/trade/exports/insights/charting-the-global-economy-iran-war-continues-to-cloud-outlook/articleshow/132340595.cms,2026-07-12T04:35:10.000000Z
2026-07-10,RBI rate hike: Interest burden for Indians may go up later this year amid inflation risks,"The Reserve Bank of India is poised to keep its policy rates steady in the short term. Nonetheless, BofA Securities predicts that rising concerns over domestic inflation could lead to increased rates in the future. Revisions to FY27 economic growth projections indicate a stronger demand trend, while external accounts are anticipated to show improvement with a reduced current account deficit.",economictimes.indiatimes.com,https://economictimes.indiatimes.com/news/economy/policy/rbi-rate-ike-chances-bank-of-america-rbirate-hike-interest-burden-for-indians-may-go-up-later-this-year-amid-inflation-risks/articleshow/132305465.cms,2026-07-10T07:08:45.000000Z
2026-07-10,"Andreessen, Chetty among leaders of Fed's new task forces evaluating operations","Venture capitalist Marc Andreessen, economist Raj Chetty and former Bank of England governor Mervyn King are among a slate of names released by the Federal Reserve Thursday that will help develop recommended changes to the central bank’s operations",abcnews.go.com,https://abcnews.com/Business/wireStory/andreessen-chetty-leaders-feds-new-task-forces-evaluating-134630239,2026-07-10T06:08:59.000000Z
2026-07-10,Central bank communications that reach the public,"We identify central bank communication shocks designed to measure how policy messages reach households. The shocks are constructed from central bank text, where policy messages originate, and newspaper narratives, through which households encounter them.",bankofengland.co.uk,https://www.bankofengland.co.uk/working-paper/2026/central-bank-communications-that-reach-the-public,2026-07-10T13:00:00.000000Z
2026-07-12,Retail inflation likely to have breached 4% mark in June,"Retail inflation is projected to exceed 4% in June, driven by rising food costs and global fuel price impacts.",thehindubusinessline.com,https://www.thehindubusinessline.com/economy/retail-inflation-likely-to-have-breached-4-mark-in-june/article71213531.ece,2026-07-12T09:23:50.000000Z
2026-07-12,"Gold, silver may stay under pressure as US-Iran tensions, inflation data hold key: Analysts","Gold and silver face volatility as US-Iran tensions and inflation data shape market outlook, limiting their recovery potential.",thehindubusinessline.com,https://www.thehindubusinessline.com/markets/gold/gold-silver-may-stay-under-pressure-as-us-iran-tensions-inflation-data-hold-key-analysts/article71213496.ece,2026-07-12T08:38:24.000000Z
2026-07-10,"Raghuram Rajan, Karen Dynan to co-lead Fed task force reviewing central bank's $6.7 trillion balance sheet",Federal Reserve Chair Kevin Warsh announced five task forces to suggest operational changes. These groups will include prominent economists and business leaders from various fields. One task force will examine artificial intelligence's impact on productivity and jobs. Another will focus on evaluating the central bank's data sources. These efforts aim to improve the Fed's analytical tools and policy approaches.,economictimes.indiatimes.com,https://economictimes.indiatimes.com/news/international/global-trends/raghuram-rajan-karen-dynan-to-co-lead-fed-task-force-reviewing-central-banks-6-7-trillion-balance-sheet/articleshow/132302879.cms,2026-07-10T04:34:06.000000Z
2026-07-10,NY Fed Says Mid-Atlantic Firms Aren’t Done Passing on Tariff Costs,"Many Mid-Atlantic U.S. businesses aren't done raising prices due to President Donald Trump's slate of import tax increases, new research from the Federal",insurancejournal.com,https://www.insurancejournal.com/news/east/2026/07/10/876939.htm,2026-07-10T05:00:45.000000Z
2026-07-13,Global Market Today: Asian shares slip as oil jumps on Gulf attacks,"Asian markets declined as intensified Gulf fighting and oil price surges rekindled inflation risks.  Oil prices climbed significantly, impacting global economic outlooks and investor sentiment.  Investors increased expectations for a Federal Reserve interest rate hike soon.  Major banks and tech companies are set to release their quarterly earnings reports.  South Korean chip stocks faced pressure, impacting the broader semiconductor sector globally.",economictimes.indiatimes.com,https://economictimes.indiatimes.com/markets/us-stocks/news/global-market-today-asian-shares-slip-as-oil-jumps-on-gulf-attacks/articleshow/132354226.cms,2026-07-13T00:48:06.000000Z
2026-07-10,"The Fed Is Staying Quiet, and That's a Very Good Thing","When new Federal Reserve chair Kevin Warsh promised to shake up monetary policy, some analysts feared he would campaign for premature interest rate cuts. But Warsh has focused instead on reforming the",realclearmarkets.com,https://www.realclearmarkets.com/2026/07/10/the_fed_is_staying_quiet_and_thats_a_very_good_thing_1193648.html,2026-07-10T08:00:16.000000Z
2026-07-10,Asian shares gain despite new US-Iran clashes,"RECAP: Asian stocks rose sharply yesterday, led by ‌chip and AI firms, as investors brushed off concern about fresh US-Iran hostilities, which has put the spotlight back on oil prices and inflation risk.",bangkokpost.com,https://www.bangkokpost.com/business/general/3284194/asian-shares-gain-despite-new-usiran-clashes,2026-07-10T18:01:00.000000Z
2026-07-12,Kevin Warsh's First FOMC Meeting Was A Success - But Where Does It Lead?,"Kevin Warsh achieved consensus at his first meeting, shifting the policy stance from easing to neutral with no dissent. Read more on the US economy here.",seekingalpha.com,https://seekingalpha.com/article/4921398-kevin-warshs-first-fomc-meeting-was-a-success-but-where-does-it-lead,2026-07-12T07:17:37.000000Z
2026-07-12,"Gold, silver rate outlook: Middle East conflict, inflation data to drive prices this week","India Business News: Precious metals are expected to remain under pressure in the coming week, with investors weighing geopolitical uncertainty in the Middle East against .",timesofindia.indiatimes.com,https://timesofindia.indiatimes.com/business/india-business/gold-silver-rate-outlook-middle-east-conflict-inflation-data-to-drive-prices-this-week/articleshow/132345030.cms,2026-07-12T11:45:15.000000Z
2026-07-12,"Mortgage and refinance interest rates today, Sunday, July 12, 2026: Mostly down from last week","These are today's mortgage and refinance rates, Sunday, July 12, 2026. Mortgage rates are mostly lower compared to last week. The current 30-year fixed rate rose by 4 basis points to 6.44%. The 20-year fixed fell by 8 basis points to 6.21%. The 15-year fixed declined by 4 basis points to 5.86%, and the 5/1 ARM fell by 8 basis points to 6.21%.",finance.yahoo.com,https://finance.yahoo.com/personal-finance/mortgages/article/mortgage-and-refinance-interest-rates-today-sunday-july-12-2026-mostly-down-from-last-week-100000227.html,2026-07-12T10:00:00.000000Z
2026-07-11,"Mortgage and refinance interest rates today, Saturday, July 11: Rates moving lower today","These are today's mortgage and refinance rates, Saturday, July 11, 2026. The current 30-year fixed rate fell by 3 basis points to 6.44%, the 15-year fixed rate fell by 9 basis points to 5.82%, and the 5/1 ARM fell by 3 basis points to 6.43%.",finance.yahoo.com,https://finance.yahoo.com/personal-finance/mortgages/article/mortgage-and-refinance-interest-rates-today-saturday-july-11-rates-moving-lower-today-100000637.html,2026-07-11T10:00:00.000000Z
2026-07-12,Comments on EconomicPolicyJournal.com: Federal Reserve to Partner With MIT in Testing a Central Bank Digital Currency,,economicpolicyjournal.com,http://www.economicpolicyjournal.com/feeds/1596155719051830542/comments/default,2026-07-12T00:12:22.000000Z
2026-07-10,"Mortgage and refinance interest rates today, Friday, July 10: Rates are mixed today, mostly higher","According to the Zillow lender marketplace, the average 30-year fixed-rate mortgage rose by 12 basis points to 6.47% today, Friday, July 10, 2026. The average 15-year fixed rate fell by 3 basis points to 5.86%. The average 5/1 ARM rose by 11 basis points to 6.46%.",finance.yahoo.com,https://finance.yahoo.com/personal-finance/mortgages/article/mortgage-and-refinance-interest-rates-today-friday-july-10-rates-are-mixed-today-mostly-higher-100000913.html,2026-07-10T10:00:00.000000Z
2026-07-11,"No escape from inflation: 'Godzilla' El Niño, AI boom, tariffs, and fuel crunch to keep prices high","""These results suggest that many businesses are still adjusting their prices, more than a year after tariffs were first introduced.""",fortune.com,https://fortune.com/2026/07/11/inflation-outlook-godzilla-el-nino-ai-boom-trump-tariffs-fuel-crunch-ukraine-war-prices/,2026-07-11T17:19:51.000000Z
2026-07-11,Goldman Sachs warns the US will bear the brunt of a global AI-induced inflation surge,"Goldman Sachs estimates that AI will increase core US inflation by around 50bp by the end of the year, five times the expected impact on other nations.",businessinsider.com,https://www.businessinsider.com/us-inflation-outlook-economy-ai-memory-software-prices-goldman-sachs-2026-7,2026-07-11T09:10:01.000000Z
2026-07-10,"Warsh task force members get an A at the outset, but results will need broad buy-in","Federal Reserve Chairman Kevin Warsh has enlisted a team of fifteen renowned external experts to spearhead reform task forces. This diverse group features both foreign central bankers and individuals from the former Obama administration, emphasizing the strength of expertise compared to other independent agencies. Warsh aims to wrap up this review process by year's end, marking a pivotal move towards possible institutional and policy overhauls.",economictimes.indiatimes.com,https://economictimes.indiatimes.com/markets/us-stocks/news/warsh-task-force-members-get-an-a-at-the-outset-but-results-will-need-broad-buy-in/articleshow/132315199.cms,2026-07-10T15:19:38.000000Z
2026-07-10,Can Walmart Help the Fed Harness Real-Time Econ. Data?,Federal Reserve Chair Kevin Warsh on Thursday tapped a former CEO of Walmart to help the U.S. central bank find better ways to keep its finger on the pulse of the U.S. economy.,realclearmarkets.com,https://www.realclearmarkets.com/2026/07/10/can_walmart_help_the_fed_harness_real-time_econ_data_1193650.html,2026-07-10T08:00:18.000000Z
2026-07-10,US stocks today: US stocks end higher as investors turn to earnings season,"US markets ended higher with the S&P 500 near record levels, driven by SK Hynixs strong Nasdaq debut and renewed momentum in AI-linked chip stocks. Investors remain cautious ahead of earnings season and inflation data, while geopolitical tensions and interest rate uncertainty continue to shape broader market sentiment.",economictimes.indiatimes.com,https://economictimes.indiatimes.com/markets/us-stocks/news/us-stocks-today-us-stocks-end-higher-as-investors-turn-to-earnings-season/articleshow/132320373.cms,2026-07-10T20:04:16.000000Z
2026-07-12,"3 reasons Bitcoin is stuck in a bear market—and why it could rebound to $100,000 by year-end","Rising inflation, Bitcoin’s four-year cycle, and excess leverage continue to draw the cryptocurrency’s price down.",fortune.com,https://fortune.com/2026/07/12/bitcoin-bear-market-three-drivers-rebound/,2026-07-12T07:00:00.000000Z
2026-07-10,"Harry Styles fans flew to Amsterdam, paid a 21% premium for hotels—and sent inflation soaring","Young people may be struggling with financial milestones, but Harry Styles fans in the Netherlands proved their spending power can catch bankers' eyes.",fortune.com,https://fortune.com/2026/07/10/harry-styles-concert-fans-sent-netherlands-inflation-soaring-europe-raise-interest-rates-gen-z-millenials-hotel-costs/,2026-07-10T07:03:00.000000Z
2026-07-13,"Fed, oil risks to keep rupee under pressure; 93 unlikely: ET Poll","The Indian rupee is projected for a slight recovery in coming months. Economists anticipate the rupee will rise just above 94 to the dollar. Subsequently, it is expected to weaken to below 95 by year-end. This outlook contrasts with earlier predictions of significant strengthening. Persistent dollar demand and global risks will likely limit gains.",economictimes.indiatimes.com,https://economictimes.indiatimes.com/markets/forex/forex-news/fed-oil-risks-to-keep-rupee-under-pressure-93-unlikely-et-poll/articleshow/132354086.cms,2026-07-13T00:01:26.000000Z
2026-07-12,Comments on EconomicPolicyJournal.com: Federal Reserve Chairman Powell in Unprecedented Video Issues Commentary on Digital Currencies,,economicpolicyjournal.com,http://www.economicpolicyjournal.com/feeds/8634466992415838845/comments/default,2026-07-12T00:12:22.000000Z
2026-07-10,Trump Refuses to Sign Bipartisan Housing Bill Carrying Digital Dollar Ban,A bipartisan housing bill that includes a temporary ban on a U.S. central bank digital currency is set to become law without President Donald Trump’s,financefeeds.com,https://financefeeds.com/trump-refuses-to-sign-bipartisan-housing-bill-carrying-digital-dollar-ban/,2026-07-10T22:40:28.000000Z
2026-07-10,Contra Corner How Kevin Warsh Can Undo The Baleful Legacy Of Alan Greenspan And His Heirs And Assigns,"Kevin Warsh is off to a reasonable start, naming task forces to look at the fundamentals of the Fed’s conduct of monetary policy. Unfortunately, however, Warsh’s five different task forces—-focused on Fed communications, balance sheet policy, economic data integrity, productivity and jobs, and inflation frameworks—-are largely populated with Fed fanboys, former central bankers and neo-Keynesian […]",davidstockmanscontracorner.com,https://www.davidstockmanscontracorner.com/how-kevin-warsh-can-undo-the-baleful-legacy-of-alan-greenspan-and-his-heirs-and-assigns/,2026-07-10T21:30:04.000000Z
2026-07-10,Turkey Central Bank Sees July Inflation as Key for Rate Outlook,"Turkey’s central bank wants to see more evidence of slowing inflation and clarity on the Iran conflict before resuming monetary easing, Governor Fatih Karahan has t…",financialpost.com,https://financialpost.com/pmn/business-pmn/turkey-central-bank-sees-july-inflation-as-key-for-rate-outlook,2026-07-10T17:31:13.000000Z
2026-07-11,5 world market themes for the week ahead,"TSMC's earnings will offer insights into AI chip demand this week. Wall Street banks are set to report, with expectations for strong corporate profits. Oil prices remain volatile amid tensions with Iran and Strait of Hormuz flows. US inflation data will gauge the Federal Reserve's stance on interest rates. Chinese economic figures will reveal the impact of global events on its growth.",economictimes.indiatimes.com,https://economictimes.indiatimes.com/markets/us-stocks/news/5-world-market-themes-for-the-week-ahead/articleshow/132324291.cms,2026-07-11T03:48:22.000000Z
2026-07-10,US CBDC Ban Set to Become Law at Midnight,A four-year ban on a U.S. central bank digital currency (CBDC) is set to take effect if a housing bill becomes law Saturday (July 11).,pymnts.com,https://www.pymnts.com/cbdc/2026/us-cbdc-ban-set-to-become-law-at-midnight/,2026-07-10T23:15:27.000000Z
2026-07-10,Custodia asks Supreme Court to rule on Fed master account,"The Wyoming digital asset bank is requesting that the high court review previous decisions granting the central bank 'unbounded, unreviewable discretion' in light of its recent Cook and Slaughter rulings. A decision could impact how cryptocurrency intersects with the standard banking system.",americanbanker.com,https://www.americanbanker.com/news/custodia-asks-supreme-court-to-rule-on-fed-master-account,2026-07-10T20:25:09.000000Z
2026-07-10,"These are America's 10 most expensive states for 2026, where inflation is punishing residents","These 10 U.S. states are the most expensive places to live in America in 2026, with inflation punishing residents to an extreme degree.",cnbc.com,https://www.cnbc.com/2026/07/10/10-most-expensive-places-to-live-america-top-states-for-business.html,2026-07-10T13:56:43.000000Z
2026-07-12,Wall Street Week Ahead,"Preview key market catalysts this week: big bank earnings, TSM, Netflix, CPI/PPI & Fed testimony—plus SpaceX valuation insights.",seekingalpha.com,https://seekingalpha.com/article/4921418-wall-street-week-ahead,2026-07-12T10:36:48.000000Z
2026-07-10,Roundup: Fed report / Air taxis / $7B healthcare acquisition,"Inflation update: In its semiannual monetary report to Congress, the Federal Reserve said inflation remains well above its 2% target rate, boosted by tariffs and other factors, and reaffirmed that restoring price stability is its top priority. The report said the U.S. economy and labor market have stayed resilient, with moderate growth despite weaker consumer […]",businessreport.com,https://www.businessreport.com/article/roundup-fed-report-air-taxis-7b-healthcare-acquisition,2026-07-10T19:58:06.000000Z
2026-07-10,French Inflation Eases As Estimated,"France's consumer price inflation slowed in June as estimated driven by the deceleration in energy price growth, final data from the statistical office INSEE showed Friday.",rttnews.com,https://www.rttnews.com/3666038/french-inflation-eases-as-estimated.aspx?type=alleco,2026-07-10T11:05:05.000000Z
2026-07-10,Norway Inflation Eases To 2.7% In June,"Norway's consumer price inflation eased unexpectedly to a four-month low in June. Consumer prices climbed 2.7 percent year-on-year in June, slower than the 3.1 percent increase in May.",rttnews.com,https://www.rttnews.com/3665993/norway-inflation-eases-to-2-7-in-june.aspx?type=alleco,2026-07-10T08:33:50.000000Z
2026-07-10,"Chip rally, Fed task forces, Delta earnings and more in Morning Squawk",Here are five key things investors need to know to start the trading day.,cnbc.com,https://www.cnbc.com/2026/07/10/5-things-to-know-before-the-stock-market-opens.html,2026-07-10T12:46:38.000000Z
2026-07-13,5 Best Stocks to Buy Following Federal Reserve Pivot Expectations,"In this article, we will discuss the 5 Best Stocks to Buy Following Federal Reserve Pivot Expectations.",insidermonkey.com,https://www.insidermonkey.com/blog/5-best-stocks-to-buy-following-federal-reserve-pivot-expectations-1799648/,2026-07-13T00:52:55.000000Z
2026-07-10,"Gold: War, Interest Rates and the Outlook for Prices?","Market Analysis by  covering: Gold Spot US Dollar, US Dollar Index Futures, Gold Futures, Brent Oil Futures. Read 's Market Analysis on Investing.com",investing.com,https://www.investing.com/analysis/gold-war-interest-rates-and-the-outlook-for-prices-200683668,2026-07-10T02:22:00.000000Z
2026-07-10,RBI faces $100 billion challenge after record currency defense,RBI faces a challenge unwinding its large bearish dollar bets. The central bank has begun trimming its massive short dollar forward position. This unwinding must be carefully managed to avoid currency market destabilization. Recent measures aim to attract foreign capital and support the rupee. Forecasters predict continued pressure on the Indian currency for the year.,economictimes.indiatimes.com,https://economictimes.indiatimes.com/news/economy/finance/rbi-faces-100-billion-challenge-after-record-currency-defense/articleshow/132302266.cms,2026-07-10T03:52:39.000000Z
2026-07-12,Gold Declines as Renewed US-Iran Strikes Raise Rate-Hike Bets,"Gold declined after the US and Iran exchanged strikes over the weekend, sending energy prices higher and once more raising the prospects for interest-rate hikes to …",financialpost.com,https://financialpost.com/pmn/business-pmn/gold-declines-as-renewed-us-iran-strikes-raise-rate-hike-bets,2026-07-12T23:48:38.000000Z
2026-07-10,Anthropic Appoints Former Fed Chair Ben Bernanke to Long-Term Benefit Trust,"Anthropic has appointed former Federal Reserve Chair Ben Bernanke to its Long-Term Benefit Trust, adding one of the world’s best-known economists to the",financefeeds.com,https://financefeeds.com/anthropic-appoints-former-fed-chair-ben-bernanke-to-long-term-benefit-trust/,2026-07-10T07:09:40.000000Z
2026-07-10,"Stock Market Outlook: 3 Things Could Derail S&P 500 Rally, Morgan Stanley Says","Morgan Stanley said it's eyeing risks facing stocks this summer, including a slowdown in AI capex and a rate hike from the Federal Reserve.",businessinsider.com,https://www.businessinsider.com/stock-market-outlook-sp500-rally-risks-interest-rates-morgan-stanley-2026-7,2026-07-10T09:15:01.000000Z
2026-07-10,PFC raises USD 300 mn via bonds carrying floating interest rates,"Power Finance Corporation, a state-run entity, has triumphantly secured USD 300 million via bonds that feature floating interest rates. Following the guidelines set by the RBI, these Notes are set to mature in July 2029 and will provide payments in US Dollars. They are scheduled for listing on NSE IFSC and India INX, marking a significant financial achievement.",economictimes.indiatimes.com,https://economictimes.indiatimes.com/markets/bonds/pfc-raises-usd-300-mn-via-bonds-carrying-floating-interest-rates/articleshow/132315575.cms,2026-07-10T15:35:11.000000Z
2026-07-10,Are the Odds of a Fed Rate Hike Rising? ETFs Worth Watching Now,"A hawkish Fed may not be off the table. Despite a recent pullback, Fed hike bets remain elevated. Here we present some ETFs that could benefit.",zacks.com,https://www.zacks.com/stock/news/2951715/are-the-odds-of-a-fed-rate-hike-rising-etfs-worth-watching-now?cid=CS-ZC-FT-etf_news_and_commentary-2951715,2026-07-10T14:50:00.000000Z
2026-07-10,Why Smart Entrepreneurs Should Watch Immigration Law as Closely as Interest Rates,"Citizenship rules can turn housing into an investment gateway, reshaping property demand, local prices and business opportunity around cities worldwide.",entrepreneur.com,https://www.entrepreneur.com/business-news/why-smart-entrepreneurs-should-watch-immigration-law-as-closely-as-interest-rates,2026-07-10T15:00:00.000000Z
2026-07-10,Czech Price Pressures Warrant Increased Caution for Central Bank,"The Czech central bank said monetary policy caution remains warranted, with the headline inflation rate likely to return to or “slightly above” the 2% target this y…",financialpost.com,https://financialpost.com/pmn/business-pmn/czech-price-pressures-warrant-increased-caution-for-central-bank,2026-07-10T12:59:37.000000Z
2026-07-13,Fed governor warns of possible interest-rate hikes if inflation comes in hot this week,Fed Governor Christopher Waller on Monday warned that the central bank may be forced to hike interest rates soon if new inflation data this week comes in hotter than expected.,nypost.com,https://nypost.com/2026/07/13/business/fed-governor-warns-of-possible-interest-rate-hikes-if-inflation-comes-in-hot-this-week/,2026-07-13T20:14:38.000000Z
2026-07-13,"It's Been Over 7 Weeks, and Fed Chair Kevin Warsh Has Failed to Make Any Headway on a Key Central Bank Reform",Jerome Powell's successor vowed to get the Fed,finance.yahoo.com,https://finance.yahoo.com/economy/policy/articles/over-7-weeks-fed-chair-082600018.html,2026-07-13T08:26:00.000000Z
2026-07-13,Fed's Waller 'concerned' about rising inflation,The Federal Reserve governor said the central bank should consider near-term rate hikes if core-measures of inflation continue to climb.,americanbanker.com,https://www.americanbanker.com/news/feds-waller-concerned-about-rising-inflation,2026-07-13T17:30:24.000000Z
2026-07-13,Fed's Waller says higher rates possibly needed in 'near term',"Federal Reserve Governor Christopher Waller signalled that interest rates may need to rise in the near term if inflation remains elevated. He warned that broadening price pressures and a potential surge in energy costs could delay progress toward the 2% target, keeping the Fed at a critical policy crossroads.",economictimes.indiatimes.com,https://economictimes.indiatimes.com/markets/us-stocks/news/feds-waller-says-higher-rates-possibly-needed-in-near-term/articleshow/132372366.cms,2026-07-13T16:57:41.000000Z
2026-07-13,Fed Should Hike “in the Near Term” if CPI & PPI this Week Are “Hot”: Fed’s Waller. So at the July Meeting? Treasury Yields Jump,"“Sternly staring at inflation until it melts before our withering gaze is not an option,” he said with a sense of urgency.

Fed Governor Christopher Waller ...",wolfstreet.com,https://wolfstreet.com/2026/07/13/fed-should-hike-in-the-near-term-if-cpi-ppi-this-week-are-hot-feds-waller-so-at-the-july-meeting-treasury-yields-jump/,2026-07-13T20:24:04.000000Z
2026-07-13,"In 7 Words, Kevin Warsh Just Sent the Clearest Signal Yet About Where Interest Rates Are Headed in 2026",Warsh's tone since becoming chair of the Federal Reserve's Board of Governors has surprised many investors.,finance.yahoo.com,https://finance.yahoo.com/economy/policy/articles/7-words-kevin-warsh-just-122500831.html,2026-07-13T12:25:00.000000Z
