date,title,description,source,url
2026-07-04,"President Donald Trump and Fed Chair Kevin Warsh Are on a Collision Course Over Interest Rates, and Things May Get Ugly for Wall Street",A new Fed chair isn't a panacea for the ideological gap between the president and the central bank over interest rates.,finance.yahoo.com,https://finance.yahoo.com/economy/policy/articles/president-donald-trump-fed-chair-082600367.html
2026-07-06,Fed Chairman Kevin Warsh Just Said 6 Words That Completely Shifted Investor Expectations,The future looks a lot different after Warsh made his policy goals clear for the Federal Reserve.,finance.yahoo.com,https://finance.yahoo.com/economy/policy/articles/fed-chairman-kevin-warsh-just-100100246.html
2026-07-06,Fed's Waller says forward guidance 'more art than science',"Federal Reserve Gov. Christopher Waller says he is OK with dialing down the amount of communication issued by the central bank's monetary policy committee, but doesn't want the central bank to throw out the baby with the bathwater.",americanbanker.com,https://www.americanbanker.com/news/feds-waller-says-forward-guidance-more-art-than-science
2026-07-04,Trump allies double down on efforts to reshape Federal Reserve,"Cook remains a target after the high court allowed her to stay in her job for now, as does former Chair Jerome Powell.",fortune.com,https://fortune.com/2026/07/04/trump-allies-federal-reserve-board-independence-lisa-cook-jerome-powell-atlanta-fed/
2026-07-06,"Gold’s Rebound Signals Markets May Have Mispriced The Fed, Says deVere CEO","Gold's recovery this week may be more than a technical rebound. According to deVere Group CEO Nigel Green, it could be an early indication that investors are",financefeeds.com,https://financefeeds.com/golds-rebound-signals-markets-may-have-mispriced-the-fed-says-devere-ceo/
2026-07-06,Gold eases from two-week high as firmer US dollar weighs,"Gold retreats from a two-week high as a stronger US dollar impacts prices, with JP Morgan forecasting $4,300/oz in Q3 2026.",thehindubusinessline.com,https://www.thehindubusinessline.com/markets/gold/gold-eases-from-two-week-high-as-firmer-us-dollar-weighs/article71188057.ece
2026-07-06,"Key Events This Week: ISM, FOMC Minutes And Fed Speakers","ZeroHedge - On a long enough timeline, the survival rate for everyone drops to zero",zerohedge.com,https://www.zerohedge.com/markets/key-events-week-ism-fomc-minutes-and-fed-speakers
2026-07-06,"Gold slips ₹150, silver drops ₹5,000 as strong US dollar dents bullion demand",Gold and silver prices drop as a strong US dollar impacts demand amid geopolitical tensions and Fed policy expectations.,thehindubusinessline.com,https://www.thehindubusinessline.com/markets/gold/gold-slips-150-silver-drops-5000-as-strong-us-dollar-dents-bullion-demand/article71188756.ece
2026-07-05,Kevin Warsh Must Explain That The Fed Simply Cannot Fight Inflation,The Fed couldn’t fight what economists incorrectly deem inflation even if it wanted to.,flipboard.com,https://www.forbes.com/sites/johntamny/2026/07/05/kevin-warsh-owes-fed-watchers-truth-about-their-inflation-confusion/
2026-07-03,"European Markets Close Higher Note On Easing Geopolitical, Interest Rate Concerns","After struggling for direction till around noon, European stocks moved higher and closed on a firm note on Friday on easing concerns about Middle East tensions and hopes that the Federal Reserve will not tighten its monetary policy for now.",rttnews.com,https://www.rttnews.com/story.aspx?Id=3664584
2026-07-06,Gold steadies after weekly gain as rate-hike worries recede,"Gold prices stabilize near $4,190 after a weekly gain, as rate-hike concerns diminish amid soft US jobs data.",thehindubusinessline.com,https://www.thehindubusinessline.com/markets/gold/gold-steadies-after-weekly-gain-as-rate-hike-worries-recede/article71187812.ece
2026-07-06,Trump’s war means higher global interest rates for years to come,"Global interest rates are set to remain higher for longer, with Bloomberg Economics forecasting borrowing costs elevated by up to half a percentage point through 2028. This shift, influenced by lingering inflation risks from the Iran conflict's energy shock and the AI race, means consumers and businesses face more expensive loans. Central banks, wary of past inflation surges, are maintaining hawkish stances, impacting economies worldwide.",economictimes.indiatimes.com,https://economictimes.indiatimes.com/news/economy/indicators/trumps-war-means-higher-global-interest-rates-for-years-to-come/articleshow/132206129.cms
2026-07-06,"Gold, Silver Rate Today Live Updates: Yellow metal holds near two-week high after weak US jobs data; silver extends gains","Gold prices began the week on a firm footing, holding close to a two-week high after weaker-than-expected US employment data reinforced expectations",timesofindia.indiatimes.com,https://timesofindia.indiatimes.com/business/india-business/gold-silver-rate-today-live-updates-18k-22-carat-24k-gold-price-10g-silver-cost-per-kg-mcx-comex-etf-stock-precious-metal-gold-prediction-city-wise-cost-latest-gold-news/liveblog/132205915.cms
2026-07-05,"Dalal Street to track oil, earnings, global trends","India Business News: NEW DELHI: Trading sentiment in the stock market this week will depend on crude oil prices, global trends and the start of corporate earnings season w.",timesofindia.indiatimes.com,https://timesofindia.indiatimes.com/business/india-business/dalal-street-to-track-oil-earnings-global-trends/articleshow/132204811.cms
2026-07-03,Why the Supreme Court's Ruling on the Fed This Week Is Good for the Stock Market,Central bank independence is critical to economic growth and healthy financial markets.,finance.yahoo.com,https://finance.yahoo.com/economy/policy/articles/why-supreme-courts-ruling-fed-165000621.html
